{
    "url": "https://aqdastravel.co.uk/elderly-senior-umrah-packages/",
    "company": "aqdastravel",
    "ppp": 1299,
    "year": 2026,
    "total_days": 7,
    "tier": "premium",
    "stars": 5,
    "departure_city": "Manchester",
    "is_visa_included": true,
    "is_ziyarat_included": true,
    "season": "Summer",
    "month": "October",
    "islamic_month": "Ramadan",
    "makkah_hotel": null,
    "madinah_hotel": {
        "total_days": null,
        "name": null,
        "images": [
            "https://aqdastravel.co.uk/wp-content/uploads/2025/10/saudi-arabia-1-scaled.jpg"
        ],
        "stars": null,
        "has_wifi": false,
        "has_ac": false,
        "distance_to_haram": null,
        "walk_to_haram": null,
        "number_of_beds": null
    }
}