{
    "url": "https://alamanahtravel.co.uk/sic/7-nights-5-star-umrah-packages/",
    "company": "alamanahtravel",
    "ppp": 710,
    "year": 2026,
    "total_days": 7,
    "tier": "luxury",
    "stars": 5,
    "departure_city": null,
    "is_visa_included": true,
    "is_ziyarat_included": true,
    "season": null,
    "month": null,
    "islamic_month": null,
    "makkah_hotel": {
        "total_days": 4,
        "name": "Fairmont Makkah Clock Royal Tower",
        "images": null,
        "stars": 5,
        "has_wifi": false,
        "has_ac": false,
        "distance_to_haram": null,
        "walk_to_haram": null,
        "number_of_beds": null
    },
    "madinah_hotel": {
        "total_days": 3,
        "name": "Anwar Al-Madinah Movenpick Hotel",
        "images": null,
        "stars": 5,
        "has_wifi": true,
        "has_ac": false,
        "distance_to_haram": null,
        "walk_to_haram": null,
        "number_of_beds": null
    }
}