{
    "url": "https://www.alhaqtravel.co.uk/book/conrad-makkah-all-inclusive-14-nights-umrah-package/",
    "company": "alhaqtravel",
    "ppp": 1984,
    "year": null,
    "total_days": 14,
    "tier": "premium",
    "stars": 5,
    "departure_city": "Manchester",
    "is_visa_included": true,
    "is_ziyarat_included": true,
    "season": null,
    "month": null,
    "islamic_month": null,
    "makkah_hotel": {
        "total_days": 14,
        "name": "Conrad Makkah - Jabal Omar",
        "images": [
            "https://www.alhaqtravel.co.uk/media/hotels/Conrad_Hotel_Dining_table.jpg",
            "https://www.alhaqtravel.co.uk/media/hotels/Conrad_Hotel_Counter.jpg",
            "https://www.alhaqtravel.co.uk/media/hotels/Conrad_Hotel_Hall.jpg",
            "https://www.alhaqtravel.co.uk/media/hotels/Conrad_Hotel_room.jpg",
            "https://www.alhaqtravel.co.uk/media/hotels/Conrad_Hotel_Gym.jpg",
            "https://www.alhaqtravel.co.uk/media/hotels/Conrad_Hotel_View.jpg",
            "https://www.alhaqtravel.co.uk/media/hotels/Conrad_Hotel_Bedrooms.jpg",
            "https://www.alhaqtravel.co.uk/media/hotels/Conrad_Hotel_Meeting_Area.jpg",
            "https://www.alhaqtravel.co.uk/media/hotels/Conrad_Hotel_Washroom.jpg",
            "https://www.alhaqtravel.co.uk/media/hotels/Conrad_Hotel_Rooms.jpg"
        ],
        "stars": null,
        "has_wifi": false,
        "has_ac": false,
        "distance_to_haram": null,
        "walk_to_haram": null,
        "number_of_beds": null
    },
    "madinah_hotel": {
        "total_days": 7,
        "name": "Maysan Al-Harithia Hotel",
        "images": [
            "https://www.alhaqtravel.co.uk/media/hotels/185528651.jpg",
            "https://www.alhaqtravel.co.uk/media/hotels/185528613.jpg",
            "https://www.alhaqtravel.co.uk/media/hotels/185528706.jpg",
            "https://www.alhaqtravel.co.uk/media/hotels/185534167.jpg",
            "https://www.alhaqtravel.co.uk/media/hotels/185528886.jpg",
            "https://www.alhaqtravel.co.uk/media/hotels/195482206.jpg",
            "https://www.alhaqtravel.co.uk/media/hotels/195482401.jpg",
            "https://www.alhaqtravel.co.uk/media/hotels/195482247.jpg",
            "https://www.alhaqtravel.co.uk/media/hotels/195482191.jpg",
            "https://www.alhaqtravel.co.uk/media/hotels/554818600.jpg",
            "https://www.alhaqtravel.co.uk/media/hotels/66593985.jpg",
            "https://www.alhaqtravel.co.uk/media/hotels/177859135.jpg"
        ],
        "stars": 5,
        "has_wifi": true,
        "has_ac": false,
        "distance_to_haram": null,
        "walk_to_haram": null,
        "number_of_beds": null
    }
}