{
    "url": "https://alhayatourstravel.com/product/easter-umrah-package-2026/?add-to-cart=2549",
    "company": "alhayatourstravel",
    "ppp": 2095,
    "year": 2026,
    "total_days": null,
    "tier": null,
    "stars": null,
    "departure_city": null,
    "is_visa_included": true,
    "is_ziyarat_included": false,
    "season": "Summer",
    "month": "March",
    "islamic_month": "Ramadan",
    "makkah_hotel": {
        "total_days": null,
        "name": "Swissotel Makkah",
        "images": null,
        "stars": null,
        "has_wifi": false,
        "has_ac": false,
        "distance_to_haram": null,
        "walk_to_haram": null,
        "number_of_beds": null
    },
    "madinah_hotel": {
        "total_days": null,
        "name": "Maden Hotel",
        "images": null,
        "stars": null,
        "has_wifi": false,
        "has_ac": false,
        "distance_to_haram": null,
        "walk_to_haram": null,
        "number_of_beds": null
    }
}