{
    "url": "https://www.zamzamtravels.org.uk/umrah-packages-2026-uk/five-star-summer-umrah-package-from-the-uk-2026",
    "company": "zamzamtravels",
    "ppp": 1595,
    "year": 2026,
    "total_days": 11,
    "tier": "premium",
    "stars": 5,
    "departure_city": "Birmingham",
    "is_visa_included": true,
    "is_ziyarat_included": true,
    "season": "Summer",
    "month": "August",
    "islamic_month": "Safar",
    "makkah_hotel": {
        "total_days": 5,
        "name": "Swissotel Makkah",
        "images": [
            "https://cdn.zamzamtravels.org.uk/images/hotels/makkah/swissotel/79949714.jpg",
            "https://cdn.zamzamtravels.org.uk/images/hotels/makkah/swissotel/79949634.jpg",
            "https://cdn.zamzamtravels.org.uk/images/hotels/makkah/swissotel/79949638.jpg",
            "https://cdn.zamzamtravels.org.uk/images/hotels/makkah/swissotel/79949644.jpg",
            "https://cdn.zamzamtravels.org.uk/images/hotels/makkah/swissotel/79949677.jpg",
            "https://cdn.zamzamtravels.org.uk/images/hotels/makkah/swissotel/79949683.jpg",
            "https://cdn.zamzamtravels.org.uk/images/hotels/makkah/swissotel/79949700.jpg"
        ],
        "stars": 5,
        "has_wifi": false,
        "has_ac": false,
        "distance_to_haram": null,
        "walk_to_haram": 4,
        "number_of_beds": null
    },
    "madinah_hotel": {
        "total_days": 5,
        "name": "Elaf Al-Taqwa Hotel",
        "images": [
            "https://cdn.zamzamtravels.org.uk/images/hotels/madinah/elaf-al-taqwa/elaf-al-taqwa-08.jpg",
            "https://cdn.zamzamtravels.org.uk/images/hotels/madinah/elaf-al-taqwa/elaf-al-taqwa-02.jpg",
            "https://cdn.zamzamtravels.org.uk/images/hotels/madinah/mysk-touch-al-balad/359481169.jpg",
            "https://cdn.zamzamtravels.org.uk/images/hotels/madinah/elaf-al-taqwa/elaf-al-taqwa-03.jpg",
            "https://cdn.zamzamtravels.org.uk/images/hotels/madinah/elaf-al-taqwa/elaf-al-taqwa-04.jpg",
            "https://cdn.zamzamtravels.org.uk/images/hotels/madinah/elaf-al-taqwa/elaf-al-taqwa-05.jpg",
            "https://cdn.zamzamtravels.org.uk/images/hotels/madinah/elaf-al-taqwa/elaf-al-taqwa-06.jpg"
        ],
        "stars": 4,
        "has_wifi": false,
        "has_ac": false,
        "distance_to_haram": null,
        "walk_to_haram": null,
        "number_of_beds": null
    }
}
