{
    "url": "https://www.labbaikhajjumrah.co.uk/packages/10-nights-5-star-luton-umrah-package/",
    "company": "labbaikhajjumrah",
    "ppp": 1303,
    "year": null,
    "total_days": 10,
    "tier": "premium",
    "stars": 5,
    "departure_city": "London",
    "is_visa_included": false,
    "is_ziyarat_included": true,
    "season": null,
    "month": null,
    "islamic_month": null,
    "makkah_hotel": {
        "total_days": 5,
        "name": "Swissotel Makkah",
        "images": [
            "https://www.labbaikhajjumrah.co.uk/wp-content/uploads/2024/07/Swissotel-Hotel-Double-Room.jpg",
            "https://www.labbaikhajjumrah.co.uk/wp-content/uploads/2024/07/Swissotel-Hotel-Kaaba-View.jpg",
            "https://www.labbaikhajjumrah.co.uk/wp-content/uploads/2024/07/Swissotel-Hotel-Quad-Room.jpg",
            "https://www.labbaikhajjumrah.co.uk/wp-content/uploads/2024/07/Swissotel-Hotel-Restaurant.jpg",
            "https://www.labbaikhajjumrah.co.uk/wp-content/uploads/2024/07/Swissotel-Hotel-single-room.jpg",
            "https://www.labbaikhajjumrah.co.uk/wp-content/uploads/2024/07/Swissotel-Hotel-Triple-Room.jpg",
            "https://www.labbaikhajjumrah.co.uk/wp-content/uploads/2024/07/Swissotel-Hotel-TV-Lounge.jpg",
            "https://www.labbaikhajjumrah.co.uk/wp-content/uploads/2024/07/Swissotel-Hotel-Buffet-Area.jpg"
        ],
        "stars": 5,
        "has_wifi": false,
        "has_ac": false,
        "distance_to_haram": 150,
        "walk_to_haram": null,
        "number_of_beds": null
    },
    "madinah_hotel": {
        "total_days": 5,
        "name": "Sofitel Shahd Al Madinah Hotel",
        "images": [
            "https://www.labbaikhajjumrah.co.uk/wp-content/uploads/2026/02/Sofitel-Shahd-Al-Madinah-double-single-room.jpg",
            "https://www.labbaikhajjumrah.co.uk/wp-content/uploads/2026/02/Sofitel-Shahd-Al-Madinah-hotel-double-room.jpg",
            "https://www.labbaikhajjumrah.co.uk/wp-content/uploads/2026/02/Sofitel-Shahd-Al-Madinah-double-room.jpg",
            "https://www.labbaikhajjumrah.co.uk/wp-content/uploads/2026/02/Sofitel-Shahd-Al-Madinah-dinning-area.jpg",
            "https://www.labbaikhajjumrah.co.uk/wp-content/uploads/2026/02/Sofitel-Shahd-Al-Madinah-building.jpg",
            "https://www.labbaikhajjumrah.co.uk/wp-content/uploads/2026/02/Sofitel-Shahd-Al-Madinah-bathroom.jpg",
            "https://www.labbaikhajjumrah.co.uk/wp-content/uploads/2026/02/Sofitel-Shahd-Al-Madinah-washroom.jpg",
            "https://www.labbaikhajjumrah.co.uk/wp-content/uploads/2026/02/Sofitel-Shahd-Al-Madinah-triple-room.jpg",
            "https://www.labbaikhajjumrah.co.uk/wp-content/uploads/2026/02/Sofitel-Shahd-Al-Madinah-sitting-area.jpg",
            "https://www.labbaikhajjumrah.co.uk/wp-content/uploads/2026/02/Sofitel-Shahd-Al-Madinah-reception-area.jpg",
            "https://www.labbaikhajjumrah.co.uk/wp-content/uploads/2026/02/Sofitel-Shahd-Al-Madinah-overview.jpg",
            "https://www.labbaikhajjumrah.co.uk/wp-content/uploads/2026/02/Sofitel-Shahd-Al-Madinah-mosque.jpg",
            "https://www.labbaikhajjumrah.co.uk/wp-content/uploads/2026/02/Sofitel-Shahd-Al-Madinah-masjid-al-nabawi-view.jpg",
            "https://www.labbaikhajjumrah.co.uk/wp-content/uploads/2026/02/Sofitel-Shahd-Al-Madinah-hotel-sitting-area.jpg"
        ],
        "stars": 5,
        "has_wifi": false,
        "has_ac": false,
        "distance_to_haram": 200,
        "walk_to_haram": null,
        "number_of_beds": null
    }
}
