{
    "url": "https://ihramtravel.co.uk/package/10-nights-5-star-glasgow-umrah-package/",
    "company": "ihramtravel",
    "ppp": 1500,
    "year": null,
    "total_days": 10,
    "tier": null,
    "stars": 5,
    "departure_city": "Glasgow",
    "is_visa_included": true,
    "is_ziyarat_included": true,
    "season": null,
    "month": null,
    "islamic_month": null,
    "makkah_hotel": {
        "total_days": 5,
        "name": null,
        "images": null,
        "stars": null,
        "has_wifi": false,
        "has_ac": false,
        "distance_to_haram": null,
        "walk_to_haram": null,
        "number_of_beds": null
    },
    "madinah_hotel": {
        "total_days": 5,
        "name": "Anwar Al-Madinah Movenpick Hotel",
        "images": null,
        "stars": null,
        "has_wifi": false,
        "has_ac": false,
        "distance_to_haram": null,
        "walk_to_haram": null,
        "number_of_beds": null
    }
}