{
    "url": "https://cheaphajjandumrah.co.uk/packages/14-nights-4-star-september-umrah-package/",
    "company": "cheaphajjandumrah",
    "ppp": 384,
    "year": 2026,
    "total_days": 14,
    "tier": "economy",
    "stars": 4,
    "departure_city": "Manchester",
    "is_visa_included": false,
    "is_ziyarat_included": true,
    "season": "Autumn",
    "month": "September",
    "islamic_month": "Rabi' al-Awwal",
    "makkah_hotel": {
        "total_days": 7,
        "name": "DoubleTree by Hilton Jabal Omar Makkah",
        "images": null,
        "stars": 4,
        "has_wifi": true,
        "has_ac": false,
        "distance_to_haram": null,
        "walk_to_haram": null,
        "number_of_beds": null
    },
    "madinah_hotel": {
        "total_days": 7,
        "name": "Rawda Al Aqiq Hotel",
        "images": null,
        "stars": null,
        "has_wifi": false,
        "has_ac": true,
        "distance_to_haram": null,
        "walk_to_haram": null,
        "number_of_beds": null
    }
}