{
    "url": "https://umrah-alamanah.com/wp-content/uploads/2024/10/October-Umrah-Packages--300x300.png",
    "company": "umrah-alamanah",
    "ppp": null,
    "year": null,
    "total_days": null,
    "tier": null,
    "stars": null,
    "departure_city": null,
    "is_visa_included": false,
    "is_ziyarat_included": false,
    "season": null,
    "month": null,
    "islamic_month": null,
    "makkah_hotel": null,
    "madinah_hotel": null
}
