{
    "url": "https://traveltoharam.co.uk/package/7-nights-3-star-umrah-package-2026/",
    "company": "traveltoharam",
    "ppp": 590,
    "year": 2026,
    "total_days": 7,
    "tier": "economy",
    "stars": 3,
    "departure_city": null,
    "is_visa_included": true,
    "is_ziyarat_included": true,
    "season": null,
    "month": null,
    "islamic_month": null,
    "makkah_hotel": {
        "total_days": 4,
        "name": "Almassa Grand Hotel",
        "images": null,
        "stars": 5,
        "has_wifi": false,
        "has_ac": false,
        "distance_to_haram": null,
        "walk_to_haram": null,
        "number_of_beds": null
    },
    "madinah_hotel": {
        "total_days": 3,
        "name": "Mirage Al Salam Hotel",
        "images": null,
        "stars": 5,
        "has_wifi": false,
        "has_ac": false,
        "distance_to_haram": null,
        "walk_to_haram": null,
        "number_of_beds": null
    }
}
