{
    "url": "https://alhayatourstravel.com/product/easter-umrah-package-2026/?add-to-cart=2549",
    "company": "alhayatourstravel",
    "ppp": 2095,
    "year": 2026,
    "total_days": 15,
    "tier": null,
    "stars": 5,
    "departure_city": "Manchester",
    "is_visa_included": true,
    "is_ziyarat_included": true,
    "season": "Spring",
    "month": "March",
    "islamic_month": "Shawwal",
    "makkah_hotel": {
        "total_days": null,
        "name": "Swissotel Makkah",
        "images": null,
        "stars": 5,
        "has_wifi": false,
        "has_ac": false,
        "distance_to_haram": null,
        "walk_to_haram": null,
        "number_of_beds": null
    },
    "madinah_hotel": {
        "total_days": null,
        "name": "Sofitel Shahd Al Madinah Hotel",
        "images": null,
        "stars": 5,
        "has_wifi": false,
        "has_ac": false,
        "distance_to_haram": null,
        "walk_to_haram": null,
        "number_of_beds": null
    }
}