{
    "url": "https://britishhajtravel.com/august-umrah-packages/",
    "company": "britishhajtravel",
    "ppp": null,
    "year": 2026,
    "total_days": null,
    "tier": "economy",
    "stars": 5,
    "departure_city": "Manchester",
    "is_visa_included": false,
    "is_ziyarat_included": false,
    "season": "Summer",
    "month": "August",
    "islamic_month": "Safar",
    "makkah_hotel": {
        "total_days": null,
        "name": null,
        "images": null,
        "stars": null,
        "has_wifi": false,
        "has_ac": false,
        "distance_to_haram": null,
        "walk_to_haram": null,
        "number_of_beds": null
    },
    "madinah_hotel": {
        "total_days": null,
        "name": null,
        "images": null,
        "stars": null,
        "has_wifi": false,
        "has_ac": false,
        "distance_to_haram": null,
        "walk_to_haram": null,
        "number_of_beds": null
    }
}