{
    "url": "https://www.labbaikhajjumrah.co.uk/packages/10-nights-5-star-luton-umrah-package/",
    "company": "labbaikhajjumrah",
    "ppp": 1303,
    "year": null,
    "total_days": 10,
    "tier": "premium",
    "stars": 5,
    "departure_city": null,
    "is_visa_included": false,
    "is_ziyarat_included": true,
    "season": null,
    "month": null,
    "islamic_month": null,
    "makkah_hotel": {
        "total_days": null,
        "name": "Swissotel Makkah",
        "images": null,
        "stars": null,
        "has_wifi": false,
        "has_ac": false,
        "distance_to_haram": null,
        "walk_to_haram": null,
        "number_of_beds": null
    },
    "madinah_hotel": {
        "total_days": null,
        "name": "Sofitel Shahd Al Madinah Hotel",
        "images": null,
        "stars": null,
        "has_wifi": false,
        "has_ac": false,
        "distance_to_haram": null,
        "walk_to_haram": null,
        "number_of_beds": null
    }
}